Chemistria,"Hey Capri, You sound SO much like my partner in how you're feeling and the fact it ties into having terrible sickness and nausea. We also have a 2Yo and at time when I've been at work she hasn't been able to cope with him on her own when she couldn't even look after herself. What medication are you on? She tried Cyclizine and promethazine both of which didn't make a bit of difference, now she's on Ondanestron and it's helped massively. She was saying the things you were at the peak of feeling ill. I'm just about to go to sleep, if you want to pm me you can, I've not sent anyone a message on here yet but I'll give it a go tomorrow. Xx",Hey carpi You sound So much like my partner in how you re feeling and the fact it ties into having terrible sickness and nausea We also have a to and at time when I ve been at work she hasn t been able to cope with him on her own when she couldn t even look after herself What meditation are you on She tried Cyclizine and promethazine both of which didn t make a bit of difference now she s on Ondanestron and it s helped passively She was saying the things you were at the peak of feeling ill I m just about to go to sleep if you want to pm me you can I ve not sent anyone a message on here yet but I ll give it a go tomorrow X ,1,28,11,22,0,0,0,0,0,0,0,0,0,0,0,0,0,0,0,0,0,0,0,0,0,0,0,0,1,0,0,0,0,0,0,0,0,0,0,0,0,0,0,0,0,0,0,0,0,0,0,0,0,0,0,0,0,0,0,0,0,0,0,0,0,0,0,0,0,0,0,0,0,0,0,0,0,0,0,0,0,0,0,0,0,0,0,0
Caprigal, I'll pm you. Xx,I ll pm you X ,1,28,11,23,0,0,0,0,0,0,0,0,0,0,0,0,0,0,0,0,0,0,0,0,0,0,0,0,0,0,0,0,0,0,0,0,0,0,0,0,0,0,0,0,0,0,0,0,0,0,0,0,0,0,0,0,0,0,0,0,0,0,0,0,0,0,0,0,0,0,0,0,0,0,0,0,0,0,0,0,0,0,0,0,0,0,0,0
Imavinoops,"HelloMy partner is convinced I need to go to the doctor as he thinks I have Antenatal Depression. Basically it's been an emotional year, we got pregnant with our first together (I have DSS who lives with us all the time) which is very exciting. However, my Dad passed away in October so this is still weighing pretty heavily on my mind sometimes and is obviously difficult to deal with. This past week has been horrible really, DP and I have argued loads and every day I have cried about something. I get pregnancy is an emotional time but is this normal? I'm bursting into tears at the tiniest things. If it isn't normal then I need to work out whether it's depression or just a reaction to having a tough time.I'm not sure what to think and my head is all over the place (as is this post! I think I'm rambling)I hate the idea of talking to the doctor as I worry I'm just overreacting really but DP is adamant I need help.I'm 25 weeks pregnant, feel happy and excited about the baby but everything else makes me feel like poo!I'm not sure if I'm asking for advice or just someone to ramble to, either way I'll leave it there.",HelloMy partner is convinced I need to go to the doctor as he thinks I have Antenatal depression basically it s been an emotional year we got pregnant with our first together I have So who lives with us all the time which is very exciting However my had passed away in October so this is still weighing pretty heavily on my mind sometimes and is obviously difficult to deal with This past week has been horrible really Do and I have argued loads and every day I have cried about something I get pregnancy is an emotional time but is this normal I m bursting into tears at the tiniest things If it isn t normal then I need to work out whether it s depression or just a reaction to having a tough time I m not sure what to think and my head is all over the place as is this post I think I m rambling I hate the idea of talking to the doctor as I worry I m just overreacting really but Do is adamant I need help I m weeks pregnant feel happy and excited about the baby but everything else makes me feel like too I m not sure if I m asking for advice or just someone to rabble to either way I ll leave it there ,3,23,11,23,0,0,0,0,0,2,0,0,0,0,0,0,0,0,0,0,0,0,0,0,0,0,0,0,0,1,0,0,0,0,0,0,0,0,0,0,0,0,0,0,1,0,0,0,0,0,0,0,0,0,0,0,0,0,0,0,0,0,0,0,0,0,1,0,0,0,0,0,0,0,0,0,0,0,0,0,0,0,0,0,0,0,0,0
Caprigal,"Hi. I would recommend going to the doctor . I was similar to you in my first pregnancy ,crying at the drop of a hat, causing arguments over silly things which I think is quite normal. Talking things over with a doctor helped me ,even if it just puts your mind at rest that everything's okay it's worth a trip. As for antenatal depression, I'm going through this myself right now in my second pregnancy. Ive been to the doctor this week and was dismissed as hormonal even though I have a history of depression. I am going back tomorrow as I know 1000% it's not hormonal. I have thoughts about a termination several times a day, I'm crying almost all day, I get no pleasure from life and the only thing keeping me going is my 2 year old son . If a trip to the doctor will put yours and your partner's mind at ease then I say do it.",Hi I would recommend going to the doctor I was similar to you in my first pregnancy crying at the drop of a hat causing arguments over silly things which I think is quite normal Talking things over with a doctor helped me even if it just puts your mind at rest that everything s okay it s worth a trip As for antenatal depression I m going through this myself right now in my second pregnancy ve been to the doctor this week and was dismissed as hormonal even though I have a history of depression I am going back tomorrow as I know it s not hormonal I have thoughts about a termination several times a day I m crying almost all day I get no pleasure from life and the only thing keeping me going is my year old son If a trip to the doctor will put yours and your partner s mind at ease then I say do it ,3,23,11,23,0,0,0,0,0,2,0,0,0,0,0,0,0,0,0,0,0,0,0,0,0,0,0,0,0,0,0,0,0,0,0,0,0,0,0,0,0,0,0,0,0,0,0,0,0,0,0,0,0,0,0,0,0,0,0,0,0,0,0,0,0,2,0,0,0,0,0,0,0,0,0,0,0,0,0,0,0,0,0,0,0,0,0,0
Tootsiepops,"My mum died in April, just four months after my daughter was born. This year has been hellish, but I didn't have ante-natal depression. I was just grieving. It wouldn't hurt to see a doctor, or maybe have some bereavement counselling? Cruse are great.",My sum died in April just four months after my daughter was born This year has been hellish but I didn t have ante fatal depression I was just grieving It wouldn t hurt to see a doctor or maybe have some bereavement counselling ruse are great ,4,24,11,0,0,0,0,0,0,1,0,0,0,0,0,0,0,0,0,0,0,0,0,0,0,0,0,0,0,0,0,0,0,0,0,0,0,0,0,0,0,0,0,0,0,0,0,0,0,0,0,0,0,0,0,0,0,0,0,0,0,0,0,0,0,0,0,0,0,0,0,0,0,0,0,0,0,0,0,0,0,0,0,0,0,0,0,0
whycanineverthinkofausername,"I've been in and out of depression since I was young and today (6weeks) I went to the doctor to talk about sharp pains down my left side. Obviously I got completely over whelmed and I broke down, she brushed aside the pains and just spoke about my depression, she said she wouldn't put me on anything until 12 weeks (that's fine as I will do anything to help this baby stick) but I'm now feeling even worse than I was before, she's given me two weeks sick note but as my partner works away it's just basically two weeks to sit here and worry and stress myself silly. I'm not sleeping either which really isn't helping. I want to try and self help myself as I realise now how much I'm not coping with absolutely anything, I cry daily. I have a wonderful boyfriend, a beautiful house, a baby on the way. Pretty much everything I've ever wanted yet I'm I'm so low. That straddled with the no sleep, constant leg and hip pain, constant nausea I feel like I'm just not ready for any of it!",I ve been in and out of depression since I was young and today weeks I went to the doctor to talk about sharp pains down my left side Obviously I got completely over helped and I broke down she brushed aside the pains and just spoke about my depression she said she wouldn t put me on anything until weeks that s fine as I will do anything to help this baby stick but I m now feeling even worse than I was before she s given me two weeks sick note but as my partner works away it s just basically two weeks to sit here and worry and stress myself silly I m not sleeping either which really isn t helping I want to try and self help myself as I realise now how much I m not coming with absolutely anything I cry daily I have a wonderful boyfriend a beautiful house a baby on the way Pretty much everything I ve ever wanted yet I m I m so low That saddled with the no sleep constant leg and hip pain constant nausea I feel like I m just not ready for any of it ,2,22,11,4,0,0,0,0,0,2,0,0,0,0,0,0,0,0,0,0,0,0,0,0,0,0,0,0,0,0,0,0,0,0,0,0,0,0,0,0,0,0,0,0,1,0,0,0,0,0,0,0,0,0,0,0,0,0,0,0,0,0,0,0,0,0,0,0,0,0,0,0,0,0,0,0,0,0,0,0,0,0,0,0,0,0,0,0
Caprigal, Go back to your doctor. I am in a similar position although I think I have antenatal depression . Your mental health is just as important as your physical health .x,Go back to your doctor I am in a similar position although I think I have antenatal depression Your mental health is just as important as your physical health x ,4,24,11,0,0,0,0,0,0,1,0,0,0,0,0,0,0,0,0,0,0,0,0,0,0,0,0,0,0,0,0,0,0,0,0,0,0,0,0,0,0,0,0,0,0,0,0,0,0,0,0,0,0,0,0,0,0,0,0,0,0,0,0,0,0,0,0,0,0,0,0,0,0,0,0,0,0,0,0,0,0,0,0,0,0,0,0,0
kath1987,I'm currently 32weeks pregnant and I feel so depressed. I have suffered with anxiety depression for about 5years but been controlled with medication. I was told to come off them which I slowly have done over the past few months. I moved (with my 4year old) 6months ago to a new town to be with my partner of 2years. All I want to do is run away.....I feel so miserable. I don't know whether it's because I've come off my tablets or if I'm genuinely unhappy. My partner doesn't understand my depression and makes me feel so alone on a daily basis......i don't know if I feel the same about him anymore. I have no family and friends in my new location and travelling for 1.5 hours to see anyone is horrible. I'm convinced I should just pack everything and move back home to where things are familiar but I'm terrified. It was such an upheaval first time I don't know if I can cope with it all at 7months pregnant but I also can't cope feeling miserable everyday. Any advise would be great x,I m currently weeks pregnant and I feel so depressed I have suffered with anxiety depression for about years but been controlled with meditation I was told to come off them which I slowly have done over the past few months I moved with my year old months ago to a new town to be with my partner of years All I want to do is run away I feel so miserable I don t know whether it s because I ve come off my tablets or if I m genuinely unhappy My partner doesn t understand my depression and makes me feel so alone on a daily basis i don t know if I feel the same about him anymore I have no family and friends in my new location and travelling for hours to see anyone is horrible I m convinced I should just pack everything and move back home to where things are familiar but I m terrified It was such an upheaval first time I don t know if I can cope with it all at months pregnant but I also can t cope feeling miserable everyday Any advise would be great x ,6,19,11,7,1,0,0,0,0,2,0,0,0,0,0,0,0,0,0,1,0,0,0,0,0,0,0,0,0,1,2,0,0,0,0,0,0,0,0,0,1,0,1,0,0,0,0,0,0,0,0,0,0,0,0,0,0,0,0,0,0,0,0,0,0,0,0,0,0,0,0,0,0,0,0,0,0,0,0,0,0,0,0,0,0,0,0,0
user1479521274," I am sorry to hear you are having such a hard time. I can't offer you any professional advice but my personal advice would be to talk to someone. Speak to your midwife during your prenatal visits, or your GP. You are not the only person battling with anxiety and depression, there is help available. Just tell someone. x",I am sorry to hear you are having such a hard time I can t offer you any professional advice but my personal advice would be to talk to someone Speak to your midwife during your parental visits or your Go You are not the only person rattling with anxiety and depression there is help available Just tell someone x ,6,19,11,7,0,0,0,0,0,1,0,0,0,0,0,0,0,0,0,0,0,0,0,0,0,0,0,0,0,0,0,0,0,0,0,0,0,0,0,0,0,0,1,0,0,0,0,0,0,0,0,0,0,0,0,0,0,0,0,0,0,0,0,0,0,0,0,0,0,0,0,0,0,0,0,0,0,0,0,0,0,0,0,0,0,0,0,0
Cantstophating,"Well, I guess that's the question. I'm currently 28 weeks with my 3rd and I can't do this. I wish I had had an abortion. I hate everything about being pregnant this time. I hate having a bump, I hate the feeling of it moving. I can't stand myself. I went to gp last week and had a complete meltdown and started on citalopram which makes me just want to sleep all day and then have horrible nights.I just want it to not exist. I don't want another one. I had a life that was just coming together, a nice house, a lovely husband and 2 children that I was coping with. I have a good job, and we are just about making it work financially. Now this. I'm going to have to go back to working 60 hours a week to pay childcare. What's the point? My life is over. I'm exhausted already with everything. My husband just doesn't get it, all he says is how 'sexy' I look with a bump. I want to hit him when he says that. I've also had an underlying eating disorder for many years that has really flared up again this pregnancy, and so far I have managed to lose weight- which I am horribly okay with.God I'm a horrible person. My life is just a sodding mess.any help would be nice.And yes, I'm fully expecting to be completely hated for everything I've written.",Well I guess that s the question I m currently weeks with my rd and I can t do this I wish I had had an abortion I hate everything about being pregnant this time I hate having a bump I hate the feeling of it moving I can t stand myself I went to up last week and had a complete meltdown and started on citalopram which makes me just want to sleep all day and then have horrible nights I just want it to not exist I don t want another one I had a life that was just coming together a nice house a lovely husband and children that I was coming with I have a good job and we are just about making it work financially Now this I m going to have to go back to working hours a week to pay childcare What s the point My life is over I m exhausted already with everything My husband just doesn t get it all he says is how sex I look with a bump I want to hit him when he says that I ve also had an underlying eating disorder for many years that has really flared up again this pregnancy and so far I have managed to lose weight which I am horribly okay with God I m a horrible person My life is just a nodding mess any help would be nice And yes I m fully expecting to be completely hated for everything I ve written ,5,18,11,12,0,1,0,0,0,0,0,0,0,0,0,0,0,0,0,0,0,0,0,0,0,0,0,0,0,2,0,0,0,0,0,0,0,0,0,0,0,0,0,0,0,0,0,0,0,0,0,0,0,0,0,0,0,0,0,0,0,0,0,0,0,0,0,0,0,0,1,0,0,0,0,0,0,0,0,0,0,0,0,0,0,0,0,0
7Days," I don't hate you. You feel like shit and things are getting too much. The practical stuff like work patterns can be parked for the time being. A week is not a long Tim for the citalopram to work. 3 kids is doable, it really is, it is hard work and you are back to nappies etc, and staying in but this child will be a delight in the same way your first two are. You are disengaged from the pregnancy and eventual child right now and that could end up being a problem. But you did the right thing by going to your gp and my advice for what its worth is to sit tight for another week and check back in with the GP. Your situation is hard but it need not be permanent. Best of luck to you",I don t hate you You feel like shit and things are getting too much The practical stuff like work patterns can be marked for the time being A week is not a long him for the citalopram to work kiss is double it really is it is hard work and you are back to happier etc and staying in but this child will be a delight in the same way your first two are You are disengaged from the pregnancy and eventual child right now and that could end up being a problem But you did the right thing by going to your up and my advice for what its worth is to sit tight for another week and check back in with the Go Your situation is hard but it need not be permanent best of luck to you ,5,18,11,21,0,0,0,0,0,0,0,0,0,0,0,0,0,0,0,0,0,0,0,0,0,0,0,0,0,0,0,0,0,0,0,0,0,0,0,0,0,0,0,0,0,0,0,0,0,0,0,0,0,0,0,0,0,0,0,0,0,0,0,0,0,0,0,0,0,0,0,0,0,0,0,0,0,0,0,0,0,0,0,0,0,0,0,0
Roobooboo," I guess I'm just looking for some support from other mummies who have been in my position. I'm currently really struggling with depression and crippling anxiety, I have a nearly 1yr old who is my world, and I am 6 weeks pregnant with my second. I was on citalopram, which wasn't working that well, although it got me back to work for a short time, but I stopped taking it as soon as I found out I was pregnant. I'm stuck in the house, I've never been able to go to baby groups, only managed weigh in group twice. I've just started counselling, which I know will be a really long journey and I just feel so lost and alone. My parents don't live far away but I have a difficult relationship with my Mum and she's not really interested anyway, no friends visit so it's just me and baby everyday until his dad gets home. Hes trying to be as supportive as he can but really doesn't understand. I guess I just want someone to tell me everything will be ok as it just feels hopeless at the moment.",I guess I m just looking for some support from other mummers who have been in my position I m currently really struggling with depression and crippling anxiety I have a nearly or old who is my world and I am weeks pregnant with my second I was on citalopram which wasn t working that well although it got me back to work for a short time but I stopped taking it as soon as I found out I was pregnant I m stuck in the house I ve never been able to go to baby groups only managed weigh in group twice I ve just started counselling which I know will be a really long journey and I just feel so lost and alone My parents don t live far away but I have a difficult relationship with my sum and she s not really interested anyway no friends visit so it s just me and baby everyday until his dad gets home He trying to be as suppurative as he can but really doesn t understand I guess I just want someone to tell me everything will be ok as it just feels hopeless at the moment ,2,15,11,15,0,0,0,0,0,1,0,0,0,0,0,0,0,0,0,1,0,0,0,0,0,0,1,0,0,0,0,0,0,0,0,0,0,0,0,0,0,0,1,0,0,0,0,0,0,0,0,0,0,0,0,0,0,0,0,0,0,0,0,0,0,0,0,0,0,0,0,0,0,0,0,0,0,0,0,0,0,0,0,0,0,0,0,0
NeedMoreSleepOrSugar,"  it's hard dealing with illness as well as a toddler without the added complication of early pregnancy (im 8 weeks and feel like shit constantly). You say friends don't visit - would it help to invite them over, or visit them? Also, have a chat with your gp and see if they can help - di they know you stopped your medication?",it s hard dealing with illness as well as a fodder without the added complication of early pregnancy in weeks and feel like shit constantly You say friends don t visit would it help to invite them over or visit them Also have a chat with your up and see if they can help di they know you stopped your meditation ,3,16,11,10,0,0,0,0,0,0,0,0,0,0,0,0,0,0,0,0,0,0,0,0,0,0,0,0,0,0,0,0,0,0,0,0,0,0,0,0,0,0,0,0,0,0,0,0,0,0,0,0,0,0,0,0,0,0,0,0,0,0,0,0,0,0,0,0,0,0,0,0,0,0,0,0,0,0,0,0,0,0,0,0,0,0,0,0
Sherbert38," Everything will be ok. I came off Citalopram when I discovered I was pregnant too and the first 12 weeks of my pregnancy were awful. I really struggled with withdrawal (stopped it straight away-not a wise move!) and had chronic morning sickness. I really couldnt see how I was going to enjoy any of my pregnancy with the way I way feeling. I also totally get the family thing, it can get very lonely. I'm now at 28 weeks and definitely feel I have come through the other side. I'm a FTM so can't imagine how hard it must be with a little one to care for on top of that. How many weeks are you now? Has your GP assigned you to a mental health midwife you can talk to? Have you got friends you can talk to about the depression with openly?Take Care x",Everything will be ok I came off Citalopram when I discovered I was pregnant too and the first weeks of my pregnancy were awful I really struggled with withdrawal stopped it straight away not a wise move and had chronic morning sickness I really couldn see how I was going to enjoy any of my pregnancy with the way I way feeling I also totally get the family thing it can get very lonely I m now at weeks and definitely feel I have come through the other side I m a TM so can t imagine how hard it must be with a little one to care for on top of that How many weeks are you now Has your Go assigned you to a mental health midwife you can talk to Have you got friends you can talk to about the depression with openly Take Care x ,3,16,11,11,0,0,0,0,0,1,0,0,0,0,0,0,0,0,1,0,0,0,0,0,0,0,0,1,0,0,0,0,0,0,0,0,0,0,0,0,0,0,0,0,0,0,0,0,0,0,0,0,0,0,0,0,0,0,0,0,0,0,0,0,0,0,0,0,0,0,0,0,0,0,0,0,0,0,0,0,0,0,0,0,0,0,0,0
Sherbert38,"Sorry I saw in your post you are 6 weeks, my pregnancy brain  It's going to be tough if you have only recently come off the Citalopram even if it seemed to not be working too well. I remember how horrible it was. Continuing at a lower dose can be an option too if you feel that would be right for you.",sorry I saw in your post you are weeks my pregnancy brain It s going to be tough if you have only recently come off the Citalopram even if it seemed to not be working too well I remember how horrible it was Continuing at a lower dose can be an option too if you feel that would be right for you ,3,16,11,11,0,0,0,0,0,0,0,0,0,0,0,0,0,0,0,0,0,0,0,0,0,0,0,0,0,1,0,0,0,0,0,0,0,0,0,0,0,0,0,0,0,0,0,0,0,0,0,0,0,0,0,0,0,0,0,0,0,0,0,0,0,0,0,0,0,0,0,0,0,0,0,0,0,0,0,0,0,0,0,0,0,0,0,0
Roobooboo," Thank you for replying! I've got my booking in appt on Monday so will explain all to my midwife then. Tbh, although it's tough looking after a little one when you feel so down etc but he's my reason I get up every day, if it wasn't for him I'd just stay in bed. I can't get out with him but at least I'm up and functioning. I didn't know they did mental health midwives, I hope mines understanding. I had the worst health visitor, she's the one thats caused all the issues in my mind as she told be I couldn't get any help until baby was 3 months old, by that point I was really struggling, had I got help from the beginning I'd probably be ok now. She's coming for his one year review tomo actually and I'm absolutely dreading seeing her. Congratulations on your little one and getting out the other side, morning sickness is the worst too, sleep was the only thing that helped me.",Thank you for replying I ve got my booking in apt on Monday so will explain all to my midwife then The although it s tough looking after a little one when you feel so down etc but he s my reason I get up every day if it wasn t for him I d just stay in bed I can t get out with him but at least I m up and sanctioning I didn t know they did mental health midwife I hope mines understanding I had the worst health visitor she s the one that caused all the issues in my mind as she told be I couldn t get any help until baby was months old by that point I was really struggling had I got help from the beginning I d probably be ok now She s coming for his one year review too actually and I m absolutely dreading seeing her congratulations on your little one and getting out the other side morning sickness is the worst too sleep was the only thing that helped me ,3,16,11,18,0,0,0,0,0,0,0,0,0,0,0,0,0,0,0,0,0,0,0,0,0,0,0,0,0,0,0,0,0,0,0,0,0,0,0,0,0,0,0,0,0,0,0,0,0,0,0,0,0,0,0,0,0,0,0,0,0,0,0,0,0,0,0,0,0,0,0,0,0,0,0,0,0,0,0,0,0,0,0,0,0,0,0,0
GTS," So this pregnancy was unplanned. My existing children are at secondary school and starting over was never something I expected. DH is thrilled, although even older than me and whilst he does have concerns, could not be happier about being a dad again. I haven't bought anything for baby, mothercare makes me hyperventilate, and baby moving (frequently) makes my toes curl. I feel sick when I think about maternity leave because I love my job and well, honestly, I'm just crap at parenting, and the thought of all the sleepless nights makes me want to sob. I'm so angry that my DH pressured me into having this baby, and that he (STILL!!!) has not had promised vasectomy. I know it takes two people to make a baby, but I'm just really angry at the world right now.",So this pregnancy was planned My existing children are at secondary school and starting over was never something I expected Do is thrilled although even older than me and whilst he does have concerns could not be happier about being a dad again I haven t bought anything for baby mothercare makes me hyperventilate and baby moving frequently makes my toes curl I feel sick when I think about paternity leave because I love my job and well honestly I m just cap at printing and the thought of all the sleepless nights makes me want to sob I m so angry that my Do pressure me into having this baby and that he STILL has not had promised vasectomy I know it takes two people to make a baby but I m just really angry at the world right now ,3,26,10,23,0,0,0,0,0,0,0,0,0,0,0,0,0,0,0,0,0,0,0,0,0,0,0,0,0,0,0,0,0,0,0,0,0,0,0,0,0,0,0,0,0,0,0,0,0,0,0,0,0,0,0,0,0,0,0,0,0,0,0,0,0,0,0,0,0,0,0,0,0,0,0,0,0,0,0,0,0,0,0,0,0,0,0,0
Mouthofmisery, Did you consider not having it? I am in a similar position. Previous PND. Really scared.,Did you consider not having it I am in a similar position previous No Really scared ,7,30,10,9,0,0,0,0,0,0,0,0,0,0,0,0,0,0,0,0,0,0,0,0,0,0,0,0,0,0,0,0,0,0,0,0,0,1,0,0,0,0,0,0,0,0,0,0,0,0,0,0,0,0,0,0,0,0,0,0,0,0,0,0,0,0,0,0,0,0,0,0,0,0,0,0,0,0,0,0,0,0,0,0,0,0,0,0
