jcne,"Has anyone? What happened about breastfeeding? I'm struggling right now, I am dormant suicidal with serious contemplation and planning probably at least 1 or 2 days of the week. I'm very very afraid.",Has anyone What happened about breastfeeding I m struggling right now I am dormant suicidal with serious contemplation and planning probably at least or days of the week I m very very afraid ,1,20,2,22,0,0,0,0,0,0,0,0,0,0,0,0,0,0,0,0,0,0,0,0,0,1,0,0,0,0,0,0,0,0,0,0,0,0,1,0,0,0,0,0,0,0,0,0,0,0,0,0,0,0,0,0,0,0,0,0,0,0,0,0,0,0,0,0,0,0,0,0,0,0,0,0,0,0,0,0,0,0,0,0,0,0,0,0
jcne,I have previously taken AD and hated them but I am desperate. I don't feel like I have a good grasp on reality at the moment.,I have previously taken A and hated them but I am desperate I don t feel like I have a good grasp on reality at the moment ,1,20,2,22,0,0,0,0,0,0,0,0,0,0,0,0,0,0,0,0,0,0,0,0,0,0,0,0,0,0,0,0,0,0,0,0,0,0,0,0,0,0,0,0,0,0,0,0,0,0,0,0,0,0,0,0,0,0,0,0,0,0,0,0,0,0,0,1,0,0,0,0,0,0,0,0,0,0,0,0,0,0,0,0,0,0,0,0
SleepyHeadThisTime,"I've just started on ADs at 37 weeks - my dr said there's lots of different kinds and although they can cross the placenta/ be passed through to your milk, this is minimal with v.v. Low risk to baby, outweighed by their positive effects for the mother. If you're feeling low or suicidal please, please talk to someone - phone the simaritans, or talk to your midwife or Doctor. You don't have to go through this alone. Can you articulate what it is that you're afraid of or for?",I ve just started on As at weeks my dr said there s lots of different kinds and although they can cross the placenta be passed through to your milk this is minimal with v v now risk to baby outweigh by their positive effects for the mother If you re feeling low or suicidal please please talk to someone phone the simaritans or talk to your midwife or Doctor You don t have to go through this alone Can you articulate what it is that you re afraid of or for ,3,1,3,21,0,0,0,0,0,0,0,0,0,0,0,0,0,0,0,1,0,0,0,0,0,1,0,0,0,0,0,0,0,0,0,0,0,0,1,0,0,0,0,0,0,0,0,0,0,0,0,0,0,0,0,0,0,0,0,0,0,0,0,0,0,0,0,0,0,0,0,0,0,0,0,0,0,0,0,0,0,0,0,0,0,0,0,0
GaryWilmotsWedding," Hi all. My second dd is 4 months old now and it's been a very difficult few months (she has been in hospital and various other bits that have made life harder than it was with my first dd). I am completely exhausted and feel on the edge of proper depression (I have been depressed previously and took anti depressants) but not quite there...yet! What I am is anxious, apathetic and frankly very bored. I am going to push myself to do one small pleasant thing a day to feel a sense of achievement. I think it might help me, but I'd like to do it with others to motivate myself! Today I am going to bake a cake because I cannot eat dairy due to dd bf and having a dairy allergy. This morning I walked dd to nursery instead of using the car. Tiny things but I think I can use them as a sort of ladder to get out of the hole I feel like I am in. I am not suggesting in any sense this is a fix for proper mental health issues, just that it might help me find a way out. Anyone want to do it too?",Hi all My second did is months old now and it s been a very difficult few months she has been in hospital and various other bits that have made life harder than it was with my first did I am completely exhausted and feel on the edge of proper depression I have been depressed previously and took anti depressants but not quite there yet What I am is anxious apathetic and frankly very bored I am going to push myself to do one small pleasant thing a day to feel a sense of achievement I think it might help me but I d like to do it with others to motivate myself Today I am going to bake a cake because I cannot eat dairy due to did of and having a dairy clergy This morning I walked did to nursery instead of using the car tiny things but I think I can use them as a sort of ladder to get out of the hole I feel like I am in I am not suggesting in any sense this is a fix for proper mental health issues just that it might help me find a way out Anyone want to do it too ,2,28,2,9,1,0,0,0,0,1,0,0,0,0,0,0,0,0,0,0,0,0,0,0,0,0,0,0,0,0,0,0,0,0,0,0,0,0,0,0,0,0,0,0,0,0,0,0,0,0,0,0,0,0,0,0,0,0,0,0,0,0,0,0,0,0,0,0,0,0,1,0,0,0,0,0,0,0,0,0,0,0,0,0,0,0,0,0
FreeWeezy,"Hi Gary  my dd is 8 months and I've been having treatment for PND since she was 5 months. My CBT therapist tells me to write a plan for each day including one pleasurable activity but I'm still finding it very difficult so I will join you!Baking a cake is great. I love baking, so relaxing and you get yummy things at the end I think today I will give dd to dp and go for a long relaxing bath ",Hi vary my did is months and I ve been having treatment for No since she was months My By therapist tells me to write a plan for each day including one pleasurable activity but I m still finding it very difficult so I will join you taking a cake is great I love baking so relaxing and you get dummy things at the end I think today I will give did to up and go for a long relaxing bath ,2,28,2,10,0,0,0,0,0,0,0,0,0,0,0,0,0,0,0,0,0,0,0,0,0,0,0,0,0,0,0,0,0,0,0,0,0,0,0,0,0,0,0,0,0,0,0,0,0,0,0,0,0,0,0,0,0,0,0,0,0,0,0,0,0,0,0,0,0,0,0,0,0,0,0,0,0,0,0,0,0,0,0,0,0,0,0,0
GaryWilmotsWedding," Hi FreeWeezy! Thanks for your response. As you'll know, just that makes me feel better ðŸ™‚. A relaxing bath sounds like a great idea. I remember them fondly! I have discovered I am short of some ingredients I need to I'm going to get all bundled up and go for a long ish walk via the shops. I almost let that derail me but Ive just got to do it! How have you found CBT? I sort of do write a plan mentally each day but one of the things I find so difficult is that babies are unpredictable and I get incredibly anxious if she does something that changes my plans! But I am not a go with the flow type at all, and trying to be has actually made things tougher. I'd be really interested to hear if CBT has helped.",Hi FreeWeezy Thanks for your response As you ll know just that makes me feel better A relaxing bath sounds like a great idea I remember them fondly I have discovered I am short of some ingredient I need to I m going to get all bundles up and go for a long is walk via the shops I almost let that detail me but ve just got to do it How have you found By I sort of do write a plan mentally each day but one of the things I find so difficult is that babies are predictable and I get incredibly anxious if she does something that changes my plans But I am not a go with the flow type at all and trying to be has actually made things rougher I d be really interested to hear if By has helped ,2,28,2,10,0,0,0,0,0,0,0,0,0,0,0,0,0,0,0,0,0,0,0,0,0,0,0,0,0,0,0,0,0,0,0,0,0,0,0,0,0,0,0,0,0,0,0,0,0,0,0,0,0,0,0,0,0,0,0,0,0,0,0,0,0,0,0,0,0,0,0,0,0,0,0,0,0,0,0,0,0,0,0,0,0,0,0,0
FreeWeezy,Well done for carrying on with your plan! I am so bad for hitting the first hurdle and just giving up. To be honest I haven't found CBT that helpful for exactly the reasons you said. It's very structured: you write your plan and you have to do everything on there but I find it difficult with baby in tow. Especially if I have a bad night with her and then I have a walk planned for the morning. It's just the last thing I want to do when I've had 2 hours sleep but then I feel so guilty and stressed if I don't do it. I have one session left and then I'm going to ask for some more counselling type therapy.Must be even harder to get stuff done with more than one child! I don't know how people do it!,Well done for carrying on with your plan I am so bad for hitting the first hardly and just giving up To be honest I haven t found By that helpful for exactly the reasons you said It s very structures you write your plan and you have to do everything on there but I find it difficult with baby in tow Especially if I have a bad night with her and then I have a walk planned for the morning It s just the last thing I want to do when I ve had hours sleep but then I feel so guilty and stressed if I don t do it I have one session left and then I m going to ask for some more counselling type therapy Must be even harder to get stuff done with more than one child I don t know how people do it ,2,28,2,11,0,0,0,0,0,0,0,0,0,0,0,0,0,0,0,0,0,0,0,0,0,0,0,0,0,0,0,0,0,0,0,0,0,0,0,0,0,0,0,0,0,0,0,0,0,0,0,0,0,0,0,0,0,0,0,0,0,0,0,0,0,0,0,0,0,0,0,0,0,0,0,0,0,0,0,0,0,0,0,0,0,0,0,0
GaryWilmotsWedding," So sorry, I have fallen at the first hurdle here! Had a rubbish day with her yesterday and just sort of let my determination drain away as the day went on! No cake made, but I did get the syrup so can do it today. I am also going to pick up a stack of interiors magazines which should make listening to her not sleeping on the monitor more bearable . Weirdly I think having two has helped me as you kind of don't have a choice but to keep going. I think I might have felt like I do now a lot earlier and more deeply if it weren't for my first. How was your bath?",So sorry I have fallen at the first hardly here Had a rubbish day with her yesterday and just sort of let my determination drain away as the day went on No cake made but I did get the syrupy so can do it today I am also going to pick up a stick of interior magazines which should make listening to her not sleeping on the monitor more bearable thirdly I think having two has helped me as you kind of don t have a choice but to keep going I think I might have felt like I do now a lot earlier and more deeply if it weren t for my first How was your bath ,3,1,3,9,0,0,0,0,0,0,0,0,0,0,0,0,0,0,0,0,0,0,0,0,0,0,0,0,0,0,0,0,0,0,0,0,0,0,0,0,0,0,0,0,0,0,0,0,0,0,0,0,0,0,0,0,0,0,0,0,0,0,0,0,0,0,0,0,0,0,0,0,0,0,0,0,0,0,0,0,0,0,0,0,0,0,0,0
FreeWeezy,"Ah well it doesn't matter. Today is a new day. Do you have much of a routine with her? Sometimes I find it easier to get things done if I set myself an approximate time to do it. So for example 'I'll bake in between her first and second nap' rather than 'I'll bake at 12' because then if I kiss that time I lose all motivation but having a larger window allows for some flexibility.I also fell at the first hurdle! No bath was had. She would not sleep! I put her down at 8 and she slept for a few hours and then cried from 11pm-1am. It was awful. And then up many times after that. I have been very lucky today and my lovely mum has come to take her from me for a few hours. I went to the gp yesterday and they've upped my dose of antidepressants so I'm feeling exhausted today. Hoping the side effects don't last as long as they did when I first started them. However I did make some cookies yesterday, even if I did burn half of them I love looking at beautiful homes! But it does just remind me how crap mine is in comparison but a girl can dream!",Ah well it doesn t matter Today is a new day Do you have much of a routine with her Sometimes I find it easier to get things done if I set myself an approximate time to do it So for example I ll bake in between her first and second nap rather than I ll bake at because then if I kiss that time I lose all motivation but having a larger window allows for some flexibility I also fell at the first hardly No bath was had She would not sleep I put her down at and she slept for a few hours and then cried from pm am It was awful And then up many times after that I have been very lucky today and my lovely sum has come to take her from me for a few hours I went to the up yesterday and they ve upper my dose of antidepressants so I m feeling exhausted today Hoping the side effects don t last as long as they did when I first started them However I did make some colonies yesterday even if I did burn half of them I love looking at beautiful homes But it does just remind me how cap mine is in comparison but a girl can dream ,3,1,3,14,0,0,0,0,0,0,0,0,0,0,0,0,0,0,0,0,0,0,0,0,0,0,0,1,0,0,0,0,0,0,0,0,0,0,0,0,0,0,0,0,0,0,0,0,0,0,0,0,0,0,0,0,0,0,0,0,0,0,0,0,0,0,1,0,0,0,1,0,0,0,0,0,0,0,0,0,0,0,0,0,0,0,0,0
SleepyHeadThisTime, Just that really - my midwife said she'd refer me after my last appointment but it's been over 2 weeks now and I've not heard anything. I'm 36 weeks now so I'm starting to worry a bit ,Just that really my midwife said she d refer me after my last appointment but it s been over weeks now and I ve not heard anything I m weeks now so I m starting to worry a bit ,4,23,2,13,0,0,0,0,0,0,0,0,0,0,0,0,0,0,0,0,0,0,0,0,0,0,0,0,0,0,0,0,0,0,0,0,0,0,0,0,0,0,0,0,1,0,0,0,0,0,0,0,0,0,0,0,0,0,0,0,0,0,0,0,0,0,0,0,0,0,0,0,0,0,0,0,0,0,0,0,0,0,0,0,0,0,0,0
londonloves,"I was referred at my booking appointment on Friday and they have given me an appointment with a consultant in June... which seems a bit far away and I'm concerned about not getting any input until then. I'm going to contact their PALS team on Monday and see if there's anything they can offer sooner, maybe you could do that too? They should be able to give you an idea of timescale. Meanwhile I'm going to try some yoga, meditation and swimming to try and help with my anxiety. Wishing you lots of love x",I was referred at my booking appointment on Friday and they have given me an appointment with a consultant in June which seems a bit far away and I m concerned about not getting any input until then I m going to contact their AS team on Monday and see if there s anything they can offer sooner maybe you could do that too They should be able to give you an idea of timescale Meanwhile I m going to try some you meditation and swimming to try and help with my anxiety Wishing you lots of love x ,7,26,2,14,0,0,0,0,0,0,0,0,0,0,0,0,0,0,0,0,0,0,0,0,0,0,0,0,0,0,0,0,0,0,0,0,0,0,0,0,0,0,1,0,0,0,0,0,0,0,0,0,0,0,0,0,0,0,0,0,0,0,0,0,0,0,0,0,0,0,0,0,0,0,0,0,0,0,0,0,0,0,0,0,0,0,0,0
SleepyHeadThisTime, Thanks London I was worried it would be a long wait - I'm due in 3 weeks and my issues are around the birth  I've made a doctors appintment for this week to see if there's a quicker route to any help that way,Thanks London I was worried it would be a long wait I m due in weeks and my issues are around the birth I ve made a doctors appointment for this week to see if there s a quicker route to any help that way ,1,27,2,22,0,0,0,0,0,0,0,0,0,0,0,0,0,0,0,0,0,0,0,0,0,0,0,0,0,0,0,0,0,0,0,0,0,0,0,0,0,0,0,1,0,0,0,0,0,0,0,0,0,0,0,0,0,0,0,0,0,0,0,0,0,0,0,0,0,0,0,0,0,0,0,0,0,0,0,0,0,0,0,0,0,0,0,0
Desperina,"Can anyone relate?About half an hour ago I filled my sink with smashed plates and glasses, scraped a knife down my arm and round my wrist (not bleeding just look like I've been tickling the wrong cat), tried to destroy my phone with a wall, tore up some paperwork and other things, hyperventilated for about 15 minutes, because bf sent me a quite insensitively worded text message. This is happening to me a lot at the moment (I am 32 weeks).I am already under the acute mental health team and awaiting a referral to peri-natal because I have been suicidal. I feel like I could do anything right now (although I have calmed down a lot). I could get in the car and go to hospital but I can't stop thinking of the satisfaction of driving it into a wall.I have been depressed for years but I've never been a screaming, raging, violent angry person. I want to die, I want to not be in this situation anymore. I don't see any way out.",Can anyone relate About half an hour ago I filled my sink with smashed plates and glasses scraped a knife down my arm and round my wrist not bleeding just look like I ve been tickling the wrong cat tried to destroy my phone with a wall tore up some paperwork and other things hyperventilated for about minutes because of sent me a quite insensitive worded text message This is happening to me a lot at the moment I am weeks I am already under the acute mental health team and awaiting a referral to peri fatal because I have been suicidal I feel like I could do anything right now although I have calmed down a lot I could get in the car and go to hospital but I can t stop thinking of the satisfaction of driving it into a wall I have been depressed for years but I ve never been a screaming raging violent angry person I want to die I want to not be in this situation anymore I don t see any way out ,6,25,2,19,1,0,0,0,0,0,0,0,0,0,0,0,0,0,0,0,0,1,0,0,0,1,0,0,0,0,0,0,0,0,0,0,0,0,0,0,0,0,0,0,0,0,0,0,0,0,0,0,0,0,0,0,0,0,0,0,0,0,0,0,0,0,0,0,0,0,0,0,0,0,0,0,0,0,0,0,0,0,0,0,0,0,0,0
Kleptronic,"Flowers for you  I can't begin to say I understand how you feel, but I have had my times. This situation is not fact. This situation will change. You can get through this. You have done well putting it out here. Feelings can and do change. How are you feeling right now?",flowers for you I can t begin to say I understand how you feel but I have had my times This situation is not fact This situation will change You can get through this You have done well putting it out here feelings can and do change How are you feeling right now ,6,25,2,19,0,0,0,0,0,0,0,0,0,0,0,0,0,0,0,0,0,0,0,0,0,0,0,0,0,0,0,0,0,0,0,0,0,0,0,0,0,0,0,0,0,0,0,0,0,0,0,0,0,0,0,0,0,0,0,0,0,0,0,0,0,0,0,0,0,0,0,0,0,0,0,0,0,0,0,0,0,0,0,0,0,0,0,0
LoveMyLittleSuperhero,"I have been in this situation myself, I would think you really need to be seen by someone tonight. Have you got the crisis teams number for your area? If not could you phone 101, they will talk to you and can send someone to come get you to offer support if needed. Please don't get in your car if you feel this way. its awful, and hormones exasperate depression like nothing I've ever known.Here for a hand hold if that's all you want/need too.",I have been in this situation myself I would think you really need to be seen by someone tonight Have you got the crisis tears number for your area If not could you phone they will talk to you and can send someone to come get you to offer support if needed Please don t get in your car if you feel this way its awful and harmonies exasperated depression like nothing I ve ever known Here for a hand hold if that s all you want need too ,6,25,2,19,0,0,0,0,0,1,0,0,0,0,0,0,0,0,0,0,0,0,0,0,0,0,0,1,0,0,0,0,0,0,0,0,0,0,0,0,0,0,0,0,0,0,0,0,0,0,0,0,0,0,0,0,0,0,0,0,0,0,0,0,0,0,0,0,0,0,0,0,0,0,0,0,0,0,0,0,0,0,0,0,0,0,0,0
Desperina,I want to die but I don't want to hurt my family. I want to hurt my boyfriend but I can't bear to hurt my family. I can't face any more from my boyfriend.,I want to die but I don t want to hurt my family I want to hurt my boyfriend but I can t bear to hurt my family I can t face any more from my boyfriend ,6,25,2,22,0,0,0,0,0,0,0,0,0,0,0,0,0,0,0,0,0,1,0,0,0,0,0,0,0,0,0,0,0,0,0,0,0,0,0,0,0,0,0,0,0,0,0,0,0,0,0,0,0,0,0,0,0,0,0,0,0,0,0,0,0,0,0,0,0,0,0,0,0,0,0,0,0,0,0,0,0,0,0,0,0,0,0,0
LoveMyLittleSuperhero, Do you want to talk about what's going on with your boyfriend? Maybe it's time to leave him and realise what amazing person you can be without him? Could you stay with your family for a while?,Do you want to talk about what s going on with your boyfriend Maybe it s time to leave him and realise what amazing person you can be without him Could you stay with your family for a while ,7,26,2,0,0,0,0,0,0,0,0,0,0,0,0,0,0,0,0,0,0,0,0,0,0,0,0,0,0,0,0,0,0,0,0,0,0,0,0,0,0,0,0,0,0,0,0,0,0,0,0,0,0,0,0,0,0,0,0,0,0,0,0,0,0,0,0,0,0,0,0,0,0,0,0,0,0,0,0,0,0,0,0,0,0,0,0,0
ScoobyDoosTinklyLaugh,"Argh it's shit, it's awful being so angry.Can you do something calming like find a meditation/yoga video, call a good friend, have a bath, do some drawing/writing anything that will occupy you and chill you out a bit.If you feel like hurting yourself then call 111/go to A and E.It sounds like you need a bit more support than what your getting. For me anti depressants stopped the rage, don't know if your on them already but maybe they need switching/upping the dose. This horrible feeling will pass I promise.",Arch it s shit it s awful being so angry Can you do something calming like find a meditation you video call a good friend have a bath do some drawing writing anything that will occupy you and chill you out a bit If you feel like hurting yourself then call go to A and E It sounds like you need a bit more support than what your getting For me anti depressants stopped the rage don t know if your on them already but maybe they need twitching cupping the dose This horrible feeling will pass I promise ,7,26,2,0,0,0,0,0,0,0,0,0,0,0,0,0,0,0,0,0,0,0,0,0,0,0,0,1,0,1,0,0,0,0,0,0,0,0,0,0,0,0,0,0,0,0,0,0,0,0,0,0,0,0,0,0,0,0,0,0,0,0,0,0,0,0,0,0,0,0,0,0,0,0,0,0,0,0,0,0,0,0,0,0,0,0,0,0
Desperina,I can't leave my bf we are having a baby and he's the only thing standing between me and whatever slosh the government throws at single mothers these days. Not to mention the social workers and the court which I would rather die than be dragged through. I'm not taking any ADs. I'm waiting for the acute MH team to become the PN MH team. Even if I did they take weeks to kick in.,I can t leave my of we are having a baby and he s the only thing standing between me and whatever slash the government throws at single mothers these days Not to mention the social workers and the court which I would rather die than be dragged through I m not taking any As I m waiting for the acute Mr team to become the N Mr team Even if I did they take weeks to kick in ,7,26,2,8,0,0,0,0,0,0,0,0,0,0,0,0,0,0,0,0,0,1,0,0,0,0,0,0,0,0,0,0,0,0,0,0,0,0,0,0,0,0,0,0,0,0,0,0,0,0,0,0,0,0,0,0,0,0,0,0,0,0,0,0,0,0,0,0,0,0,0,0,0,0,0,0,0,0,0,0,0,0,0,0,0,0,0,0
ScoobyDoosTinklyLaugh,"How are you doing now?Anti D's had an affect on me very very quickly, within days of taking them. For the first couple of weeks on them I felt snoozy and spaced out, still low mood but not angry angry. After that couple of weeks the snooziness lifted and I began to feel normal again.",How are you doing now Anti D s had an affect on me very very quickly within days of taking them For the first couple of weeks on them I felt snowy and space out still low mood but not angry angry After that couple of weeks the snooziness lifted and I began to feel normal again ,7,26,2,20,0,0,0,0,0,0,0,0,0,0,0,0,0,0,0,0,0,0,0,0,0,0,0,0,0,0,0,0,0,0,0,0,0,0,0,0,0,0,0,0,0,0,0,0,0,0,0,0,0,0,0,0,0,0,0,0,0,0,0,0,0,0,0,0,0,0,0,0,0,0,0,0,0,0,0,0,0,0,0,0,0,0,0,0
Crazycatlady123,"Last Thursday (16th) I had a c-section after a failed horrible induction which lasted 2 days. I was discharged following day and it's been a tougher week that I could have possibly imagined physically and mentally and I'm terrified I'm getting PND.My DH has been a superstar and I've had my mum helping too but it's been so hard watching them run around doing everything e.g. changing nappies, her clothes etc while I do very little except breastfeed her which is nothing but painful despite checking and rechecking the latch. Up until last couple of days even sleep (little of it) has been so uncomfortable and I feel like I can't breathe half the time. Moved the co-sleeper crib to DH's side because of difficulty of me getting in/out of bed which has also been tough, feel like I should be closer to my baby.My emotions are all over the place which I know is normal, and although I'm starting to feel more recovered physically, I feel like I'm hopeless at everything I try and do for her. I feel like I'm failing her for not being able to breastfeed properly and giving up today, and that I might do something wrong and hurt her unintentionally e.g. hold her wrong, drop her, the list of anxieties are endless. Plus, I love her but I'm not elated like everyone else seems to be after having a baby, DH is on cloud 9 but I feel sad a lot of the time.I have got a history of anxiety but have been fine for a few years. I had a normal pregnancy, I feel like I'm losing my mind and terrified of when I'm going to take care of her on my own. I just want to feel like a good mum.",Last Thursday th I had a c section after a failed horrible induction which lasted days I was discharged following day and it s been a rougher week that I could have possibly imagined physically and mentally and I m terrified I m getting No My Do has been a superstar and I ve had my sum helping too but it s been so hard watching them run around doing everything e g changing happier her clothes etc while I do very little except breasted her which is nothing but painful despite checking and checking the latch Up until last couple of days even sleep little of it has been so uncomfortable and I feel like I can t breathe half the time Moved the co sleeper crib to Do s side because of difficulty of me getting in out of bed which has also been tough feel like I should be closer to my baby My emotions are all over the place which I know is normal and although I m starting to feel more recovered physically I feel like I m hopeless at everything I try and do for her I feel like I m failing her for not being able to breasted properly and giving up today and that I might do something wrong and hurt her unintentionally e g hold her wrong drop her the list of anxieties are endless Pus I love her but I m not elated like everyone else seems to be after having a baby Do is on cloud but I feel sad a lot of the time I have got a history of anxiety but have been fine for a few years I had a normal pregnancy I feel like I m losing my mind and terrified of when I m going to take care of her on my own I just want to feel like a good sum ,5,24,2,9,0,0,0,0,0,0,0,0,0,0,0,0,0,0,0,0,0,0,0,0,0,0,1,0,0,1,0,0,0,0,0,0,0,0,0,0,2,0,1,0,0,0,0,0,0,0,0,0,0,0,0,0,0,0,0,0,0,0,0,0,0,0,0,0,0,0,0,0,0,0,0,0,0,0,0,0,0,0,0,0,0,0,0,0
