Caprigal,"I'm 10 weeks now . I think the medication is helping ,I'm on a very low dose of sertraline ,I was prescribed 50mg but I take a quarter of a pill a day . Aw congratulations! If youre happy and it's what is right for you, all the best! How far along are you? I'd definetly speak to your doctor and midwife about your feelings , because if you do have a bit of depression and it's left untreated it can lead to post natal depression .I don't say that to scare you but it's a risk and that's why I decided to go back onto medication. I have a friend who's been referred to councilling because she's petrified of labour so that might be something to consider for you. I have always had depression so I think the hormones triggered it back off when I got pregnant. I nearly lost my first son and had to have an emergency c section, and the whole pregnancy was horrible too, so I have a lot of fear from that. I hope your pregnancy goes great , and if at any point you need to chat , feel free to drop me a message. X",I m weeks now I think the meditation is helping I m on a very low dose of sertraline I was prescribed my but I take a quarter of a pill a day A congratulations If your happy and it s what is right for you all the best How far along are you I d definitely speak to your doctor and midwife about your feelings because if you do have a bit of depression and it s left untreated it can lead to post fatal depression I don t say that to scare you but it s a risk and that s why I decided to go back onto meditation I have a friend who s been referred to counselling because she s petrified of labour so that might be something to consider for you I have always had depression so I think the harmonies trigger it back off when I got pregnant I nearly lost my first son and had to have an emergency c section and the whole pregnancy was horrible too so I have a lot of fear from that I hope your pregnancy goes great and if at any point you need to chat feel free to drop me a message X ,2,13,12,19,0,0,0,0,0,3,0,0,0,0,0,0,0,0,0,0,0,0,0,0,0,0,0,0,0,1,0,0,0,0,0,0,0,0,0,0,0,0,0,0,0,0,0,0,0,0,0,0,0,0,0,0,0,0,0,0,0,0,0,0,0,0,0,0,0,0,0,0,0,0,0,0,0,0,0,0,0,0,0,0,0,0,0,0
Tonijo1990,I wish I had kept the baby for sureI'm still heart broken everyday and have asked for counsellingI was on sertraline low dose and I don't think it was high enoughI don't ever want to get pregnant again and to make it worse friends are now announcing pregnancies and would've been due when my baby wasMy sister has also had a baby and looking at her makes me feel so guiltyI wish I didn't have my friend and ex sort of pressuring me into itI always said I would've never had an abortion and I knew I didn't want one deep downI believe I made all deductions to quickly I would've been about five months nowI try and stay strong for my other children and tell myself I did the right decisionBut I know I didn'tXx,I wish I had kept the baby for sure m still heart broken everyday and have asked for counselling was on sertraline low dose and I don t think it was high enough don t ever want to get pregnant again and to make it worse friends are now announcing pregnancies and would ve been due when my baby was sister has also had a baby and looking at her makes me feel so guilty wish I didn t have my friend and ex sort of pressing me into it always said I would ve never had an abortion and I knew I didn t want one deep down believe I made all deductions to quickly I would ve been about five months now try and stay strong for my other children and tell myself I did the right decisionBut I know I didn tax ,7,18,12,19,0,0,0,0,0,0,0,0,0,0,0,0,0,0,0,0,0,0,0,0,0,0,0,0,0,0,0,0,0,0,0,0,0,0,0,0,0,0,0,0,0,0,0,0,0,0,0,0,0,0,0,0,0,0,0,0,0,0,0,0,0,0,0,0,0,0,0,0,0,0,0,0,0,0,0,0,0,0,0,0,0,0,0,0
Caprigal,"Hi Tonijo I feel for you I really do. I'd go back to the doctor and ask about medication again , I know that some people don't like being on it but if you need it,you need it. Please try to not beat yourself up over it , you obviously were in a difficult position and as you said , your situation was from ideal so you did what you thought was best at the time. Have you spoke to your friend about how you feel? That might help?It can take a while for councilling sessions to come through so maybe give Arch a call and speak to them ? They are an abortion recovery help line, there may be others out there but this is the one I found. The number is 0845 603 8501. There's an email address if you want to google them and find that too. Maybe write a letter to your child and bury it , burn it , tie it to a balloon and let it go? Put all your feelings in this letter and see if you can get a bit of closure. You deserve to be happy and you have your children to pull you through. Stay strong. Xx",Hi Tonijo I feel for you I really do I d go back to the doctor and ask about meditation again I know that some people don t like being on it but if you need it you need it Please try to not beat yourself up over it you obviously were in a difficult position and as you said your situation was from ideal so you did what you thought was best at the time Have you spoke to your friend about how you feel That might help It can take a while for counselling sessions to come through so maybe give Arch a call and speak to them They are an abortion recovery help line there may be others out there but this is the one I found The number is There s an email address if you want to goose them and find that too Maybe write a letter to your child and bury it burn it tie it to a balloon and let it go Put all your feelings in this letter and see if you can get a bit of closure You deserve to be happy and you have your children to pull you through Stay strong X ,7,18,12,20,0,0,0,0,0,0,0,0,0,0,0,0,0,0,0,0,0,0,0,0,0,0,0,0,0,0,0,0,0,0,0,0,0,0,0,0,0,0,0,0,0,0,0,0,0,0,0,0,0,0,0,0,0,0,0,0,0,0,0,0,0,0,0,0,0,0,0,0,0,0,0,0,0,0,0,0,0,0,0,0,0,0,0,0
blondebuddha,"Not quite sure where to start or what it is that I'm looking to get out of this post so might just be rambling for abit hoping it makes me feel better. I'm in a situation where I know I should go and see my gp about depression but I can't bring myself to do it. I hate them, I've never had a good experience with doctors and I just can't imagine what I'm supposed to say, never mind what their reaction would be. How can i go in and explain what's wrong if I don't know what's wrong in the first place? I think it started when I was teenager and it never completely went away, I self harmed a lot but it's 10 years at least since I've come close to doing that again. Having a baby has really fucked my head up but I honestly don't understand why. My daughter is amazing. Being a Mum is hard and exhausting and bewildering but amazing. And I see this gorgeous little thing that I managed to create and I'm fucking ignoring her because I'm too busy sitting on the bed crying. She's learnt to bring me a tissue when I'm crying because it's just a regular occurrence for mummy to be abit sad and she fucking cuddles me and brings me a teddy because she knows that's what makes her happy and then she'll go off and play with her toys or get her crayons out and she thinks nothing of playing on her own because that's how it's always been. And then I'll get more upset at myself but I still can't bring myself to do anything about it because my brain just tells me that im a disgrace and there's no point anyway. I've tried to talk to my own mum about it to see if she felt like this with me but I get nothing. I've been bought up with depression being something that is made up by people who don't want to go to work. It's something that people should just stop feeling because you've got nothing bad happening and there's kids starving in Africa and they always smile so why can't I. I can be fine for a while. Might be days or might be a couple of hours like this morning and then it just sneaks up on you. Something little might start it off today like my face looked all blotchy and horrible even after I tried to hide it with make up and then I noticed how fat I looked and that I need to go up a trousers size again even after I spent ages losing all that weight. I put weight on because I found out I was pregnant a little while ago and ate all the foods I wanted to and made plans of new babies and names and colours and due dates and shit and then I lost it and I couldn't talk to anyone because no one knew and I felt like I wasn't allowed to grieve because it wasn't a baby or a thing it was just cells and bits and everyone kept telling me how it could have been really bad but it was fucking really bad. I've decided I'm not going to go back and read what I've written and change it all I just need to post it so people can read it and probably tell me I need to see a doctor. I don't feel any better for writing that and I really wish I did. It has made me think that maybe it's pnd and then I was perhaps doing ok but I had a miscarriage and it's come back again. My husbands going to come home and tell that I've been crying and I hate it when that happens He tried really hard and I feel like I'm letting him down too. He never knows if he's coming home to me being a horrible bastard in a mood or the version that is doing ok and is on top of the housework and the kids and everyone is fine. Now I just feel really deflated and empty like I've got everything off my chest and I'm not sure where to go from here. I'm sorry to anyone that reads all that bollocks. Thanks though. It's abit reassuring to know someone might be reading that and going through the same thing or has been through it and knows what's at the other end",Not quite sure where to start or what it is that I m looking to get out of this post so might just be rambling for bit hoping it makes me feel better I m in a situation where I know I should go and see my up about depression but I can t bring myself to do it I hate them I ve never had a good experience with doctors and I just can t imagine what I m supposed to say never mind what their reaction would be How can i go in and explain what s wrong if I don t know what s wrong in the first place I think it started when I was teenager and it never completely went away I self harmed a lot but it s years at least since I ve come close to doing that again Having a baby has really tucked my head up but I honestly don t understand why My daughter is amazing Being a sum is hard and exhausting and bewildering but amazing And I see this gorgeous little thing that I managed to create and I m fucking ignoring her because I m too busy sitting on the bed crying She s learnt to bring me a tissue when I m crying because it s just a regular occurrence for dummy to be bit sad and she fucking muddles me and brings me a teddy because she knows that s what makes her happy and then she ll go off and play with her toys or get her crayons out and she thinks nothing of playing on her own because that s how it s always been And then I ll get more upset at myself but I still can t bring myself to do anything about it because my brain just tells me that in a disgrace and there s no point anyway I ve tried to talk to my own sum about it to see if she felt like this with me but I get nothing I ve been bought up with depression being something that is made up by people who don t want to go to work It s something that people should just stop feeling because you ve got nothing bad happening and there s kiss starving in Africa and they always smile so why can t I I can be fine for a while Might be days or might be a couple of hours like this morning and then it just speaks up on you Something little might start it off today like my face looked all blotch and horrible even after I tried to hide it with make up and then I noticed how fat I looked and that I need to go up a trousers size again even after I spent ages losing all that weight I put weight on because I found out I was pregnant a little while ago and ate all the foods I wanted to and made plans of new babies and names and colours and due dates and shit and then I lost it and I couldn t talk to anyone because no one knew and I felt like I wasn t allowed to grieve because it wasn t a baby or a thing it was just cells and bits and everyone kept telling me how it could have been really bad but it was fucking really bad I ve decided I m not going to go back and read what I ve written and change it all I just need to post it so people can read it and probably tell me I need to see a doctor I don t feel any better for writing that and I really wish I did It has made me think that maybe it s and and then I was perhaps doing ok but I had a miscarriage and it s come back again My husbands going to come home and tell that I ve been crying and I hate it when that happens He tried really hard and I feel like I m letting him down too He never knows if he s coming home to me being a horrible bastard in a mood or the version that is doing ok and is on top of the homework and the kiss and everyone is fine Now I just feel really defeated and empty like I ve got everything off my chest and I m not sure where to go from here I m sorry to anyone that reads all that blocks Thanks though It s bit reassuring to know someone might be reading that and going through the same thing or has been through it and knows what s at the other end ,3,14,12,18,0,0,0,0,0,2,0,0,0,0,0,0,0,0,0,0,0,0,0,0,0,0,0,0,0,2,0,1,0,0,0,0,0,0,0,0,0,0,0,0,0,0,0,0,0,0,0,0,0,0,0,0,0,0,0,0,0,0,0,0,0,3,0,0,0,0,0,0,0,0,0,0,0,0,0,0,0,0,0,1,0,0,1,0
FATEdestiny,"You could b9okmark this webpage on your phone and take it with you to the doctors. Give the GP your phone to read what you wrote here.Or write a letter/note and give to gp Or print off an NHS leaflet or poster for post natal depression and hand that to your gp saying ""this is me""",You could b remark this webpage on your phone and take it with you to the doctors Give the Go your phone to read what you wrote here Or write a letter note and give to up Or print off an He leaflet or poster for post fatal depression and hand that to your up saying this is me ,3,14,12,19,0,0,0,0,0,1,0,0,0,0,0,0,0,0,0,0,0,0,0,0,0,0,0,0,0,0,0,0,0,0,0,0,0,0,0,0,0,0,0,0,0,0,0,0,0,0,0,0,0,0,0,0,0,0,0,0,0,0,0,0,0,0,0,0,0,0,0,0,0,0,0,0,0,0,0,0,0,0,0,0,0,0,0,0
Mummabear22,"I have a beautiful 11month old DD, I was diagnosed with PND and anxiety when she was 6 weeks old. I had been doing so well up until I returned to work 1month ago, now it's backs but 10x worse than it was, I have been signed off work and they have upped my meds! Not looking for advice, just needed to get it off my chest and see if anyone else had this?",I have a beautiful month old Do I was diagnosed with No and anxiety when she was weeks old I had been doing so well up until I returned to work month ago now it s backs but x worse than it was I have been signed off work and they have upper my beds Not looking for advice just needed to get it off my chest and see if anyone else had this ,3,14,12,13,0,0,0,0,0,0,0,0,0,0,0,1,0,0,0,0,0,0,0,0,0,0,0,0,0,0,0,0,0,0,0,0,0,0,0,0,0,0,1,0,0,0,0,0,0,0,0,0,0,0,0,0,0,0,0,0,0,0,0,0,0,0,0,0,0,0,0,0,0,0,0,0,0,0,0,0,0,0,0,0,0,0,0,0
oleoleoleole,"I suffered a long time ago with PND after DS 2. With hindsight I think I set my sights too high in terms of being able to achieve housework, job, mummy time and I juggled and put pressure on myself to get it all perfect, which is impossible as we know. I certainly think that contributed to My PND. I wish I'd chilled out more and lived with a messy house and piles of washing and spent more time enjoying being a mum. Going back to work has possibly been your trigger, can you work less hours perhaps? I'm not sure if what I've said has helped but don't be too hard on yourself. The most important thing is to be a mum, then an employee, housewife etc. Good luck X",I suffered a long time ago with No after Do With insight I think I set my sights too high in terms of being able to achieve homework job dummy time and I judged and put pressure on myself to get it all perfect which is impossible as we know I certainly think that contributed to My No I wish I d chilled out more and lived with a mess house and piles of washing and spent more time enjoying being a sum Going back to work has possibly been your trigger can you work less hours perhaps I m not sure if what I ve said has helped but don t be too hard on yourself The most important thing is to be a sum then an employee housewife etc Good luck X ,3,14,12,13,0,0,0,0,0,0,0,0,0,0,0,0,0,0,0,0,0,0,0,0,0,0,0,0,0,0,0,0,0,0,0,0,0,0,0,0,0,0,0,0,0,0,0,0,0,0,0,0,0,0,0,0,0,0,0,0,0,0,0,0,0,0,0,0,0,0,0,0,0,0,0,0,0,0,0,0,0,0,0,0,0,0,0,0
Rebocalucy,"Hi everyone, After trying to battle my PND on my own for 4 months Iv had enough and decided to take my citalopram that has been sat in my cupboard for a month. I'm pretty scared of side effects and hoping these will work !! Can anyone share and stories with me ? To put my mind at ease. My dose is 10mg. Thankyou xx",Hi everyone After trying to battle my No on my own for months I had enough and decided to take my citalopram that has been sat in my cupboard for a month I m pretty scared of side effects and hoping these will work Can anyone share and stories with me To put my mind at ease My dose is my Thankyou ex ,1,14,11,15,0,0,0,0,0,0,0,0,0,0,0,0,0,0,0,0,0,0,0,0,0,0,0,0,0,0,0,0,0,0,0,0,0,1,0,0,0,0,0,0,0,0,0,0,0,0,0,0,0,0,0,0,0,0,0,0,0,0,0,0,0,0,0,0,0,0,0,0,0,0,0,0,0,0,0,0,0,0,0,0,0,0,0,0
alloutofnameideas,I take 20mg a day and after the first couple of weeks of feeling a bit shaky I'm much better. Sometimes forget to take it and can notice a difference in my stress levels,I take my a day and after the first couple of weeks of feeling a bit shake I m much better Sometimes forget to take it and can notice a difference in my stress levels ,1,14,11,16,0,0,0,0,0,0,0,0,0,0,0,0,0,0,0,0,0,0,0,0,0,0,0,0,0,0,0,0,0,0,0,0,0,0,0,0,0,0,0,0,0,0,0,0,0,0,0,0,0,0,0,0,0,0,0,0,0,0,0,0,0,0,0,0,0,0,0,0,0,0,0,0,0,0,0,0,0,0,0,0,0,0,0,0
Rebocalucy," Thankyou for such a quick reply, I suppose I can't feel worse than I do ! ,",Thankyou for such a quick reply I suppose I can t feel worse than I do ,1,14,11,16,0,0,0,0,0,0,0,0,0,0,0,0,0,0,0,0,0,0,0,0,0,0,0,0,0,0,0,0,0,0,0,0,0,0,0,0,0,0,0,0,0,0,0,0,0,0,0,0,0,0,0,0,0,0,0,0,0,0,0,0,0,0,0,0,0,0,0,0,0,0,0,0,0,0,0,0,0,0,0,0,0,0,0,0
Pocketsizedpixie," I found that I didn't particularly notice any side effects, but started to feel significantly better within about two weeks of starting them - I wish I'd done it sooner. I hope they help for you too.",I found that I didn t particularly notice any side effects but started to feel significantly better within about two weeks of starting them I wish I d done it sooner I hope they help for you too ,1,14,11,16,0,0,0,0,0,0,0,0,0,0,0,0,0,0,0,0,0,0,0,0,0,0,0,0,0,0,0,0,0,0,0,0,0,0,0,0,0,0,0,0,0,0,0,0,0,0,0,0,0,0,0,0,0,0,0,0,0,0,0,0,0,0,0,0,0,0,0,0,0,0,0,0,0,0,0,0,0,0,0,0,0,0,0,0
Rebocalucy," THankyou ! I'm so so hopeful ! I'm desperate to feel myself again, it's been a long 4 months  I'm just scared the side effects will be severe but then again that could be my anxiety as I mainly suffer anxiety. Thankyou x",THankyou I m so so hopeful I m desperate to feel myself again it s been a long months I m just scared the side effects will be severe but then again that could be my anxiety as I mainly suffer anxiety Thankyou x ,1,14,11,16,0,0,0,0,0,0,0,0,0,0,0,0,0,0,0,0,0,0,0,0,0,0,0,0,0,0,0,0,0,0,0,0,0,1,0,0,0,0,2,0,0,0,0,0,0,0,0,0,0,0,0,0,0,0,0,0,0,0,0,0,0,0,0,1,0,0,0,0,0,0,0,0,0,0,0,0,0,0,0,0,0,0,0,0
ScoobyDoosTinklyLaugh,I'm on 10mg and felt loads better after a couple of weeks. Didn't have any side effects apart from felt quite tired the first few days of taking them but that could of been a coincidence.,I m on my and felt loads better after a couple of weeks Didn t have any side effects apart from felt quite tired the first few days of taking them but that could of been a coincidence ,1,14,11,16,0,0,0,0,0,0,0,0,0,0,0,0,0,0,0,0,0,0,0,0,0,0,0,0,0,0,0,0,0,0,0,0,0,0,0,0,0,0,0,0,0,0,0,0,0,0,0,0,0,0,0,0,0,0,0,0,0,0,0,0,0,0,0,0,0,0,0,0,0,0,0,0,0,0,0,0,0,0,0,0,0,0,0,0
Rebocalucy, Fab Thankyou  this is making me feel much more at ease ! x,Far Thankyou this is making me feel much more at ease x ,1,14,11,17,0,0,0,0,0,0,0,0,0,0,0,0,0,0,0,0,0,0,0,0,0,0,0,0,0,0,0,0,0,0,0,0,0,0,0,0,0,0,0,0,0,0,0,0,0,0,0,0,0,0,0,0,0,0,0,0,0,0,0,0,0,0,0,0,0,0,0,0,0,0,0,0,0,0,0,0,0,0,0,0,0,0,0,0
AChristmasCactus," I take 20 plus 300mg Quetiapine for bipolar. I was told that 10mg is not enough for a therapeutic effect, so yours might need to go up a bit. Be prepared to ask your GP. It took four weeks to work for me.",I take plus my Quetiapine for bipolar I was told that my is not enough for a therapeutic effect so yours might need to go up a bit Be prepared to ask your Go It took four weeks to work for me ,1,14,11,17,0,0,0,0,0,0,0,0,0,0,0,0,1,0,0,0,0,0,0,0,0,0,0,0,0,0,0,0,0,0,0,0,0,0,0,0,0,0,0,0,0,0,0,0,0,0,0,0,0,0,0,0,0,0,0,0,0,0,0,0,0,0,0,0,0,0,0,0,0,0,0,0,0,0,0,0,0,0,0,0,0,0,0,0
dovesong,Felt a bit sick the first few days but miles better after that and much happier too. Like a cloud had been lifted. Delighted I decided to go on them. Good luck with it ,felt a bit sick the first few days but miles better after that and much happier too Like a cloud had been lifted Delighted I decided to go on them Good luck with it ,1,14,11,17,0,0,0,0,0,0,0,0,0,0,0,0,0,0,0,0,0,0,0,0,0,0,0,0,0,0,0,0,0,0,0,0,0,0,0,0,0,0,0,0,0,0,0,0,0,0,0,0,0,0,0,0,0,0,0,0,0,0,0,0,0,0,0,0,0,0,0,0,0,0,0,0,0,0,0,0,0,0,0,0,0,0,0,0
Rebocalucy, You guys are awesome Thankyou ! X,You guns are awesome Thankyou X ,1,14,11,17,0,0,0,0,0,0,0,0,0,0,0,0,0,0,0,0,0,0,0,0,0,0,0,0,0,0,0,0,0,0,0,0,0,0,0,0,0,0,0,0,0,0,0,0,0,0,0,0,0,0,0,0,0,0,0,0,0,0,0,0,0,0,0,0,0,0,0,0,0,0,0,0,0,0,0,0,0,0,0,0,0,0,0,0
Rebocalucy, Can I ask what time of the day would be best to take the Meds ?,Can I ask what time of the day would be best to take the beds ,1,14,11,17,0,0,0,0,0,0,0,0,0,0,0,0,0,0,0,0,0,0,0,0,0,0,0,0,0,0,0,0,0,0,0,0,0,0,0,0,0,0,0,0,0,0,0,0,0,0,0,0,0,0,0,0,0,0,0,0,0,0,0,0,0,0,0,0,0,0,0,0,0,0,0,0,0,0,0,0,0,0,0,0,0,0,0,0
ScoobyDoosTinklyLaugh,"I take mine at night, because they made me sleepy at first. Hopefully you'll snooze through any other side effects! Good luck ",I take mine at night because they made me sleepy at first hopefully you ll ooze through any other side effects Good luck ,1,14,11,18,0,0,0,0,0,0,0,0,0,0,0,0,0,0,0,0,0,0,0,0,0,0,0,0,0,0,0,0,0,0,0,0,0,0,0,0,0,0,0,0,0,0,0,0,0,0,0,0,0,0,0,0,0,0,0,0,0,0,0,0,0,0,0,0,0,0,0,0,0,0,0,0,0,0,0,0,0,0,0,0,0,0,0,0
debka,"I've been taking 20mg of citalopram for about 5 months. Feel like me again. Fabulous stuff and no side effects. Agree that 10mg is a low dose though, you may need to titrated up.I take mine at night too.",I ve been taking my of citalopram for about months Feel like me again fabulous stuff and no side effects agree that my is a low dose though you may need to situated up I take mine at night too ,1,14,11,18,0,0,0,0,0,0,0,0,0,0,0,0,0,0,0,0,0,0,0,0,0,0,0,0,0,0,0,0,0,0,0,0,0,0,0,0,0,0,0,0,0,0,0,0,0,0,0,0,0,0,0,0,0,0,0,0,0,0,0,0,0,0,0,0,0,0,0,0,0,0,0,0,0,0,0,0,0,0,0,0,0,0,0,0
ineedamoreadultieradult, I've been taking 20mg for just over 3 weeks now. The first 4 or 5 days I felt I was a bit high everything was very fuzzy and I felt queasy and I thought I would have to stop taking them because I couldn't cope with the feeling but I continued and I'm so glad. Pretty much bang on the 2 week mark I felt like my old self like a weight had been lifted and I could see things clearly again. Best thing I ever did was finally go to the Doctor and tell him how I had been feeling.,I ve been taking my for just over weeks now The first or days I felt I was a bit high everything was very fully and I felt easy and I thought I would have to stop taking them because I couldn t cope with the feeling but I continued and I m so glad Pretty much bang on the week mark I felt like my old self like a weight had been lifted and I could see things clearly again best thing I ever did was finally go to the Doctor and tell him how I had been feeling ,1,14,11,18,0,0,0,0,0,0,0,0,0,0,0,0,0,0,0,0,0,0,0,0,0,0,0,0,0,0,0,0,0,0,0,0,0,0,0,0,0,0,0,0,0,0,0,0,0,0,0,0,0,0,0,0,0,0,0,0,0,0,0,0,0,0,0,0,0,0,0,0,0,0,0,0,0,0,0,0,0,0,0,0,0,0,0,0
weaselwords, I had no side effects and it worked like a charm for me when I had a mild/moderate agitated depression.,I had no side effects and it worked like a charm for me when I had a mild moderate agitated depression ,1,14,11,18,0,0,0,0,0,1,0,1,0,1,0,0,0,0,0,0,0,0,0,0,0,0,0,0,0,0,0,0,0,0,0,0,0,0,0,0,0,0,0,0,0,0,0,0,0,0,0,0,0,0,0,0,0,0,0,0,0,0,0,0,0,0,0,0,0,0,0,0,0,0,0,0,0,0,0,0,0,0,0,0,0,0,0,0
Rebocalucy," Thanks all. I'm sat here with a much better mind set, I'm hoping they knock me out so I can have some proper sleep tonight ! Xx",Thanks all I m sat here with a much better mind set I m hoping they knock me out so I can have some proper sleep tonight X ,1,14,11,18,0,0,0,0,0,0,0,0,0,0,0,0,0,0,0,0,0,0,0,0,0,0,0,0,0,0,0,0,0,0,0,0,0,0,0,0,0,0,0,0,0,0,0,0,0,0,0,0,0,0,0,0,0,0,0,0,0,0,0,0,0,0,0,0,0,0,0,0,0,0,0,0,0,0,0,0,0,0,0,0,0,0,0,0
Rebocalucy, Right guys Iv just taken my first tablet ! I did start to have a panic attack afterwards but I managed to control this and it's calmed ! Wish me luck ! Xx,Right guns I just taken my first tablet I did start to have a panic attack afterwards but I managed to control this and it s calmed Wish me luck X ,1,14,11,20,0,0,0,0,0,0,0,0,0,0,0,0,0,0,0,0,0,0,0,0,0,0,0,0,0,0,0,0,0,0,0,0,0,0,0,0,0,0,0,0,0,0,0,0,0,0,0,0,0,0,0,0,0,0,0,0,0,0,0,0,0,0,0,0,0,0,0,0,0,0,0,0,0,0,0,0,0,0,0,0,0,0,0,0
AChristmasCactus, Good luck and well done ,Good luck and well done ,1,14,11,22,0,0,0,0,0,0,0,0,0,0,0,0,0,0,0,0,0,0,0,0,0,0,0,0,0,0,0,0,0,0,0,0,0,0,0,0,0,0,0,0,0,0,0,0,0,0,0,0,0,0,0,0,0,0,0,0,0,0,0,0,0,0,0,0,0,0,0,0,0,0,0,0,0,0,0,0,0,0,0,0,0,0,0,0
